{
  "button": {
    "AddTarget": "Добавить\nцель",
    "Complete": "Завершить",
    "PayManual": "Заплатить вручную"
  },
  "label": {
    "Amount": "Сумма",
    "CreateNewAccount": "Создать новый счёт для цели",
    "HowToAccumulate": "Как учитывать накопленное?",
    "Interval": "Периодичность",
    "Name": "Название",
    "NewAccountName": "Название счета для цели",
    "PayAmount": "Откладывать по",
    "PayFromAccount": "Откладывать со счёта",
    "Remain": "Осталось",
    "ReserveOnAccount": "Резервировать сумму на счёте",
    "StartPaySince": "Начать откладывать с",
    "TotalAmount": "Сумма"
  },
  "RemoveQuest": "Вы действительно хотите удалить выбранную Цель? Это приведёт к удалению всех связанных транзакций, что может привести к изменению остатков на счетах.",
  "RemoveQuestSimple": "Вы действительно хотите удалить выбранную Цель?",
  "state": {
    "Completed": "Выполненные",
    "Pending": "Намеченные"
  },
  "title": {
    "CreateTarget": "Создание цели",
    "OperationsHistory": "История платежей",
    "page": "Цели",
    "PayManual": "Заплатить вручную"
  }
}
