{
  "button": {
    "AddTarget": "Προσθήκη\nιμή-στόχος",
    "Complete": "Ολοκληρώθηκε",
    "PayManual": "Οδηγός πληρωμής"
  },
  "label": {
    "Amount": "Ποσό",
    "CreateNewAccount": "Δημιουργία νέου λογαριασμού",
    "HowToAccumulate": "Πώς να συσσωρεύω? ",
    "Interval": "Διάστημα",
    "Name": "Όνομα",
    "NewAccountName": "Νέο όνομα λογαριασμού",
    "PayAmount": "Ποσό πληρωμής",
    "PayFromAccount": "Πληρωμή από λογαριασμό",
    "Remain": "Παραμονή",
    "ReserveOnAccount": "Αποθεματικό στον πηγαίο λογαριασμό",
    "StartPaySince": "Έναρξη πληρωμής από",
    "TotalAmount": "Συνολικό ποσό"
  },
  "RemoveQuest": "Είστε βέβαιοι ότι θέλετε να διαγράψετε το στόχο με όλες τις σχετικές συναλλαγές; Μπορεί να αλλάξει το υπόλοιπο των λογαριασμών.",
  "RemoveQuestSimple": "Είστε βέβαιοι να διαγράψετε το στόχο?",
  "state": {
    "Completed": "Ολοκληρώθηκε",
    "Pending": "Σε εκκρεμότητα"
  },
  "title": {
    "CreateTarget": "Δημιουργία προορισμού",
    "OperationsHistory": "Ιστορικό λειτουργιών ",
    "page": "Στόχοι",
    "PayManual": "Οδηγός πληρωμής"
  }
}
